{
  "id": "/subscriptions/00000000-0000-0000-0000-000000000000/resourceGroups/my-rg/providers/Microsoft.App/containerApps/my-app",
  "name": "my-container-app",
  "type": "Microsoft.App/containerApps",
  "properties": {
    "createdTime": "2026-04-19T12:00:00Z",
    "lastActiveTime": "2026-04-19T12:00:00Z",
    "fqdn": "my-container-app.eastus.azurecontainerapps.io",
    "active": true,
    "replicas": 1,
    "trafficWeight": 100,
    "provisioningError": "example-string",
    "healthState": "Healthy",
    "provisioningState": "Succeeded",
    "runningState": "Running"
  }
}